05:01:31.828976 IP 172.19.0.3.51754 > 172.19.0.2.22: tcp 0
05:01:31.829045 IP 172.19.0.2.22 > 172.19.0.3.51754: tcp 0
05:01:31.829072 IP 172.19.0.3.51754 > 172.19.0.2.22: tcp 0
05:01:31.829603 IP 172.19.0.3.51754 > 172.19.0.2.22: tcp 41
05:01:31.829645 IP 172.19.0.2.22 > 172.19.0.3.51754: tcp 0
05:01:31.830094 IP 172.19.0.2.22 > 172.19.0.3.51754: tcp 41
05:01:31.830111 IP 172.19.0.3.51754 > 172.19.0.2.22: tcp 0
05:01:31.830695 IP 172.19.0.3.51754 > 172.19.0.2.22: tcp 1432
05:01:31.831817 IP 172.19.0.2.22 > 172.19.0.3.51754: tcp 1080
05:01:31.834910 IP 172.19.0.3.51754 > 172.19.0.2.22: tcp 48
05:01:31.843223 IP 172.19.0.2.22 > 172.19.0.3.51754: tcp 596
05:01:31.846852 IP 172.19.0.3.51754 > 172.19.0.2.22: tcp 16
05:01:31.887062 IP 172.19.0.2.22 > 172.19.0.3.51754: tcp 0
05:01:31.887092 IP 172.19.0.3.51754 > 172.19.0.2.22: tcp 44
05:01:31.887122 IP 172.19.0.2.22 > 172.19.0.3.51754: tcp 0
05:01:31.887499 IP 172.19.0.2.22 > 172.19.0.3.51754: tcp 44
05:01:31.887798 IP 172.19.0.3.51754 > 172.19.0.2.22: tcp 68
05:01:31.897188 IP 172.19.0.2.22 > 172.19.0.3.51754: tcp 52
05:01:31.939058 IP 172.19.0.3.51754 > 172.19.0.2.22: tcp 0
05:01:34.952647 IP 172.19.0.3.51754 > 172.19.0.2.22: tcp 148
05:01:34.995258 IP 172.19.0.2.22 > 172.19.0.3.51754: tcp 0
05:01:35.097105 IP 172.19.0.2.22 > 172.19.0.3.51754: tcp 28
05:01:35.097159 IP 172.19.0.3.51754 > 172.19.0.2.22: tcp 0
05:01:35.097435 IP 172.19.0.3.51754 > 172.19.0.2.22: tcp 112
05:01:35.097482 IP 172.19.0.2.22 > 172.19.0.3.51754: tcp 0
05:01:35.119341 IP 172.19.0.2.22 > 172.19.0.3.51754: tcp 628
05:01:35.163101 IP 172.19.0.3.51754 > 172.19.0.2.22: tcp 0
05:01:35.163159 IP 172.19.0.2.22 > 172.19.0.3.51754: tcp 44
05:01:35.163171 IP 172.19.0.3.51754 > 172.19.0.2.22: tcp 0
05:01:35.163451 IP 172.19.0.3.51754 > 172.19.0.2.22: tcp 376
05:01:35.165119 IP 172.19.0.2.22 > 172.19.0.3.51754: tcp 108
05:01:35.165419 IP 172.19.0.2.22 > 172.19.0.3.51754: tcp 500
05:01:35.165492 IP 172.19.0.3.51754 > 172.19.0.2.22: tcp 0
05:01:35.173739 IP 172.19.0.2.22 > 172.19.0.3.51754: tcp 92
05:01:35.215118 IP 172.19.0.3.51754 > 172.19.0.2.22: tcp 0
05:01:35.868897 IP 172.19.0.3.51754 > 172.19.0.2.22: tcp 44
05:01:35.869354 IP 172.19.0.2.22 > 172.19.0.3.51754: tcp 44
05:01:35.869383 IP 172.19.0.3.51754 > 172.19.0.2.22: tcp 0
05:01:36.976169 IP 172.19.0.3.51754 > 172.19.0.2.22: tcp 36
05:01:36.976380 IP 172.19.0.2.22 > 172.19.0.3.51754: tcp 52
05:01:36.976410 IP 172.19.0.3.51754 > 172.19.0.2.22: tcp 0
05:01:36.976617 IP 172.19.0.2.22 > 172.19.0.3.51754: tcp 44
05:01:36.976638 IP 172.19.0.3.51754 > 172.19.0.2.22: tcp 0
05:01:36.978874 IP 172.19.0.2.22 > 172.19.0.3.51754: tcp 176
05:01:36.978901 IP 172.19.0.3.51754 > 172.19.0.2.22: tcp 0
05:01:36.978994 IP 172.19.0.3.51754 > 172.19.0.2.22: tcp 36
05:01:36.979048 IP 172.19.0.3.51754 > 172.19.0.2.22: tcp 60
05:01:36.979088 IP 172.19.0.2.22 > 172.19.0.3.51754: tcp 0
05:01:36.979094 IP 172.19.0.3.51754 > 172.19.0.2.22: tcp 0
05:01:36.981957 IP 172.19.0.2.22 > 172.19.0.3.51754: tcp 0
05:01:36.981993 IP 172.19.0.3.51754 > 172.19.0.2.22: tcp 0
05:01:39.966088 IP 172.19.0.3.51636 > 172.19.0.2.22: tcp 0
05:01:39.966146 IP 172.19.0.2.22 > 172.19.0.3.51636: tcp 0
05:01:39.966167 IP 172.19.0.3.51636 > 172.19.0.2.22: tcp 0
05:01:39.966561 IP 172.19.0.3.51636 > 172.19.0.2.22: tcp 41
05:01:39.966583 IP 172.19.0.2.22 > 172.19.0.3.51636: tcp 0
05:01:39.967425 IP 172.19.0.2.22 > 172.19.0.3.51636: tcp 41
05:01:39.967460 IP 172.19.0.3.51636 > 172.19.0.2.22: tcp 0
05:01:39.968651 IP 172.19.0.3.51636 > 172.19.0.2.22: tcp 1432
05:01:39.969787 IP 172.19.0.2.22 > 172.19.0.3.51636: tcp 1080
05:01:39.972684 IP 172.19.0.3.51636 > 172.19.0.2.22: tcp 48
05:01:39.980904 IP 172.19.0.2.22 > 172.19.0.3.51636: tcp 596
05:01:39.984659 IP 172.19.0.3.51636 > 172.19.0.2.22: tcp 16
05:01:40.027105 IP 172.19.0.2.22 > 172.19.0.3.51636: tcp 0
05:01:40.027146 IP 172.19.0.3.51636 > 172.19.0.2.22: tcp 44
05:01:40.027204 IP 172.19.0.2.22 > 172.19.0.3.51636: tcp 0
05:01:40.027508 IP 172.19.0.2.22 > 172.19.0.3.51636: tcp 44
05:01:40.028067 IP 172.19.0.3.51636 > 172.19.0.2.22: tcp 68
05:01:40.037523 IP 172.19.0.2.22 > 172.19.0.3.51636: tcp 52
05:01:40.079126 IP 172.19.0.3.51636 > 172.19.0.2.22: tcp 0
05:01:42.199999 IP 172.19.0.3.51636 > 172.19.0.2.22: tcp 148
05:01:42.243095 IP 172.19.0.2.22 > 172.19.0.3.51636: tcp 0
05:01:42.272526 IP 172.19.0.2.22 > 172.19.0.3.51636: tcp 28
05:01:42.272554 IP 172.19.0.3.51636 > 172.19.0.2.22: tcp 0
05:01:42.272710 IP 172.19.0.3.51636 > 172.19.0.2.22: tcp 112
05:01:42.272733 IP 172.19.0.2.22 > 172.19.0.3.51636: tcp 0
05:01:42.293940 IP 172.19.0.2.22 > 172.19.0.3.51636: tcp 628
05:01:42.335115 IP 172.19.0.3.51636 > 172.19.0.2.22: tcp 0
05:01:42.335175 IP 172.19.0.2.22 > 172.19.0.3.51636: tcp 44
05:01:42.335190 IP 172.19.0.3.51636 > 172.19.0.2.22: tcp 0
05:01:42.335283 IP 172.19.0.3.51636 > 172.19.0.2.22: tcp 376
05:01:42.336847 IP 172.19.0.2.22 > 172.19.0.3.51636: tcp 108
05:01:42.337137 IP 172.19.0.2.22 > 172.19.0.3.51636: tcp 500
05:01:42.337170 IP 172.19.0.3.51636 > 172.19.0.2.22: tcp 0
05:01:42.349322 IP 172.19.0.2.22 > 172.19.0.3.51636: tcp 92
05:01:42.391108 IP 172.19.0.3.51636 > 172.19.0.2.22: tcp 0
05:01:43.530988 IP 172.19.0.3.51636 > 172.19.0.2.22: tcp 44
05:01:43.531300 IP 172.19.0.2.22 > 172.19.0.3.51636: tcp 44
05:01:43.531328 IP 172.19.0.3.51636 > 172.19.0.2.22: tcp 0
05:01:43.879698 IP 172.19.0.3.51636 > 172.19.0.2.22: tcp 36
05:01:43.880296 IP 172.19.0.2.22 > 172.19.0.3.51636: tcp 60
05:01:43.880355 IP 172.19.0.3.51636 > 172.19.0.2.22: tcp 0
05:01:43.882852 IP 172.19.0.2.22 > 172.19.0.3.51636: tcp 176
05:01:43.882879 IP 172.19.0.3.51636 > 172.19.0.2.22: tcp 0
05:01:43.882982 IP 172.19.0.3.51636 > 172.19.0.2.22: tcp 36
05:01:43.883044 IP 172.19.0.3.51636 > 172.19.0.2.22: tcp 60
05:01:43.883096 IP 172.19.0.3.51636 > 172.19.0.2.22: tcp 0
05:01:43.883102 IP 172.19.0.2.22 > 172.19.0.3.51636: tcp 0
05:01:43.888566 IP 172.19.0.2.22 > 172.19.0.3.51636: tcp 0
05:01:43.888727 IP 172.19.0.3.51636 > 172.19.0.2.22: tcp 0
